{
  "schemaVersion": 1,
  "id": "ese-shiori",
  "displayName": "ese-shiori (Native)",
  "kinds": ["shiori"],
  "origin": "independent",
  "upstream": {
    "url": "https://github.com/opera7133/utatane-modules",
    "author": "opera7133"
  },
  "delivery": "binary",
  "license": "MIT",
  "licenseURL": "https://github.com/opera7133/utatane-modules/blob/main/LICENSE",
  "instructions": "docs/ese-shiori.md",
  "limitations": ["ese-shioriの独自Swift実装です。Windows版の全機能・全電文との互換性は保証しません。"],
  "version": "3.03",
  "revision": 1,
  "abi": "shiori-load-request-unload",
  "minimumOS": "14.0",
  "source": {"kind": "local", "path": "native"},
  "recipe": "recipes/ese-shiori/build.sh",
  "requiredFiles": [
    "lib/libese-shiori.dylib",
    "LICENSES/utatane-MIT.txt",
    "README.md"
  ]
}
