{
  "schemaVersion": 1,
  "id": "satori",
  "displayName": "里々",
  "kinds": [
    "shiori"
  ],
  "origin": "upstream-port",
  "upstream": {
    "url": "https://github.com/ukatech/satoriya-shiori",
    "author": "SEIBIHAN"
  },
  "delivery": "binary",
  "license": "BSD-2-Clause",
  "licenseURL": "https://github.com/opera7133/satoriya-shiori/blob/97675886da3e61c45684a94056aa41e5b5b6359e/LICENSE.txt",
  "instructions": "docs/satori.md",
  "limitations": [
    "Unicode版はUTF-8で保存するため、旧版へ戻すとセーブデータが文字化けする場合があります。更新前にバックアップしてください。",
    "Windows用SAORIは実行できません。同梱または共通導入したmacOS用SAORIを使用してください。",
    "同じプロセス内では1セッション。複数ゴーストは別プロセスで実行してください。"
  ],
  "version": "Mc205-4",
  "revision": 1,
  "abi": "shiori-utf8-v1",
  "minimumOS": "14.0",
  "source": {
    "url": "https://github.com/opera7133/satoriya-shiori.git",
    "path": "sources/satori",
    "commit": "97675886da3e61c45684a94056aa41e5b5b6359e"
  },
  "recipe": "recipes/satori/build.sh",
  "requiredFiles": [
    "lib/libsatori.dylib",
    "LICENSES/satori-BSD-2-Clause.txt",
    "LICENSES/utatane-MIT.txt",
    "README.md",
    "LICENSES/deelx-notice.txt",
    "LICENSES/uka_regexp-Unlicense.txt"
  ]
}
