{
  "schemaVersion": 1,
  "id": "textcopy",
  "displayName": "textcopy (Native)",
  "kinds": [
    "saori"
  ],
  "origin": "independent",
  "upstream": {
    "url": "https://github.com/opera7133/utatane",
    "author": "opera7133"
  },
  "originalURL": "https://github.com/ukatech/csaori/tree/1ddb8c9024bb4716fa3ac25d05c819fad224e459/impl_saori/textcopy2",
  "delivery": "binary",
  "license": "MIT",
  "licenseURL": "https://github.com/opera7133/utatane-modules/blob/main/LICENSE",
  "instructions": "docs/saori.md",
  "limitations": [
    "textcopy2と同じ引数仕様。返却指定と第3引数の改行置換に対応。macOSのUnicodeクリップボードを使用する。"
  ],
  "version": "0.1.0",
  "revision": 1,
  "abi": "saori-utf8-v1",
  "minimumOS": "14.0",
  "source": {
    "kind": "local",
    "path": "native"
  },
  "recipe": "recipes/textcopy/build.sh",
  "requiredFiles": [
    "lib/libtextcopy.dylib",
    "LICENSES/utatane-MIT.txt",
    "README.md"
  ],
  "windowsFilenames": [
    "textcopy.dll"
  ]
}
