{
  "schemaVersion": 1,
  "id": "yaya",
  "displayName": "YAYA",
  "kinds": [
    "shiori"
  ],
  "windowsFilenames": [
    "yaya.dll",
    "aya.dll",
    "aya5.dll"
  ],
  "origin": "upstream-port",
  "upstream": {
    "url": "https://github.com/YAYA-shiori/yaya-shiori",
    "author": "SEIBIHAN"
  },
  "delivery": "binary",
  "license": "BSD-3-Clause",
  "licenseURL": "https://github.com/opera7133/yaya-shiori/blob/bde38a186a12418cce0ad6f4f03730137311e298/LICENSE",
  "instructions": "docs/yaya.md",
  "limitations": [
    "Windows用SAORIは実行できません。同梱または共通導入したmacOS用SAORIを使用してください。",
    "同じプロセス内では1セッション。複数ゴーストは別プロセスで実行してください。"
  ],
  "version": "Tc574-11",
  "revision": 2,
  "abi": "shiori-utf8-v1",
  "minimumOS": "14.0",
  "source": {
    "url": "https://github.com/opera7133/yaya-shiori.git",
    "path": "sources/yaya",
    "commit": "bde38a186a12418cce0ad6f4f03730137311e298"
  },
  "recipe": "recipes/yaya/build.sh",
  "requiredFiles": [
    "lib/libyaya.dylib",
    "LICENSES/yaya-BSD-3-Clause.txt",
    "LICENSES/utatane-MIT.txt",
    "README.md"
  ]
}
