{
  "schemaVersion": 1,
  "id": "minato",
  "displayName": "minato",
  "kinds": [
    "shiori"
  ],
  "origin": "upstream-port",
  "upstream": {
    "url": "https://github.com/mizuki-yura/minato",
    "author": "mizuki-yura"
  },
  "delivery": "binary",
  "license": "MIT",
  "licenseURL": "https://github.com/opera7133/minato/blob/968e2c40954c917dbeafa6db8e3e1ff49ea33fb7/LICENSE",
  "instructions": "docs/minato.md",
  "limitations": [
    "Windows用SAORI/DLLは実行できません。macOS用SAORIを使用してください。",
    "同じプロセス内では1セッション。Utataneはゴーストごとにプロセスを分離します。"
  ],
  "version": "0.2.0",
  "revision": 1,
  "abi": "shiori-utf8-v1",
  "minimumOS": "14.0",
  "source": {
    "url": "https://github.com/opera7133/minato.git",
    "path": "sources/minato",
    "commit": "968e2c40954c917dbeafa6db8e3e1ff49ea33fb7"
  },
  "recipe": "recipes/minato/build.sh",
  "requiredFiles": [
    "lib/libminato.dylib",
    "LICENSES/minato-MIT.txt",
    "LICENSES/THIRD-PARTY-LICENSES.toml",
    "README.md"
  ]
}
