{
  "schemaVersion": 1,
  "id": "pasta",
  "displayName": "pasta",
  "kinds": [
    "shiori"
  ],
  "origin": "upstream-port",
  "upstream": {
    "url": "https://github.com/ekicyou/pasta",
    "author": "ekicyou"
  },
  "delivery": "binary",
  "license": "MIT",
  "licenseURL": "https://github.com/opera7133/pasta/blob/9360b74c9b41746d046e16ef97340c207afc999d/LICENSE",
  "instructions": "docs/pasta.md",
  "limitations": [
    "Windows専用のLua FFI呼び出しやDLLは実行できません。",
    "同じプロセス内では1セッション。Utataneはゴーストごとにプロセスを分離します。"
  ],
  "version": "0.4.2",
  "revision": 1,
  "abi": "shiori-utf8-v1",
  "minimumOS": "14.0",
  "source": {
    "url": "https://github.com/opera7133/pasta.git",
    "path": "sources/pasta",
    "commit": "9360b74c9b41746d046e16ef97340c207afc999d"
  },
  "recipe": "recipes/pasta/build.sh",
  "requiredFiles": [
    "lib/libpasta.dylib",
    "LICENSES/pasta-MIT.txt",
    "LICENSES/dependencies.json",
    "README.md"
  ]
}
