{
  "schemaVersion": 1,
  "id": "textcopy2",
  "displayName": "textcopy2 (Native)",
  "kinds": [
    "saori"
  ],
  "origin": "independent",
  "upstream": {
    "url": "https://github.com/opera7133/utatane",
    "author": "opera7133"
  },
  "originalURL": "https://github.com/ukatech/csaori/tree/master/impl_saori/textcopy2",
  "delivery": "binary",
  "license": "MIT",
  "licenseURL": "https://github.com/opera7133/utatane-modules/blob/main/LICENSE",
  "instructions": "docs/saori.md",
  "limitations": [
    "Windows版のすべての機能を再現するものではありません。対応コマンドは導入手順を参照してください。"
  ],
  "version": "0.1.0",
  "revision": 5,
  "abi": "saori-utf8-v1",
  "minimumOS": "14.0",
  "source": {
    "kind": "local",
    "path": "native"
  },
  "recipe": "recipes/textcopy2/build.sh",
  "requiredFiles": [
    "lib/libtextcopy2.dylib",
    "LICENSES/utatane-MIT.txt",
    "README.md"
  ]
}
