{
  "schemaVersion": 1,
  "id": "shino",
  "displayName": "忍 (Native)",
  "kinds": ["shiori"],
  "origin": "independent",
  "upstream": {
    "url": "https://github.com/opera7133/utatane-modules",
    "author": "opera7133"
  },
  "originalURL": "https://web.archive.org/web/20020802124805/http://ryu.4th.to/nanika/shino/",
  "delivery": "binary",
  "license": "MIT",
  "licenseURL": "https://github.com/opera7133/utatane-modules/blob/main/LICENSE",
  "instructions": "docs/shino.md",
  "limitations": ["忍 0.9.7の独自Swift実装です。元のWindows DLLと完全互換ではありません。"],
  "version": "0.9.7",
  "revision": 3,
  "abi": "shiori-load-request-unload",
  "minimumOS": "14.0",
  "source": {"kind": "local", "path": "native"},
  "recipe": "recipes/shino/build.sh",
  "requiredFiles": [
    "lib/libshino.dylib",
    "LICENSES/utatane-MIT.txt",
    "README.md"
  ]
}
